descripcion,precio,titulo
,U$S410,Cachorros  Beagle Envios A Nivel Nacional
,U$S220,Husky Siberiano  Envíos Y Entregas A Nivel Nacional
,"U$S7,75",Maquina De Cortar Pelo Para Perro Bajo Ruido Y Vibración
,U$S420,"Pug Carlino, Envíos Y  Entregas A Todo El País."
,U$S295,Labrador Retriever
,U$S67,Baño De Mascotas Portátil Para Gatos Y Perros
,U$S420,Preciosos Beagle Envíos Y Entregas A Nivel Nacional
,U$S30,Cobertor Protector Forro Asientos Para Autos De Mascotas
,"U$S9,98","Cama Mascotas Perros, Gatos, Calidad Premiun"
,"U$S29,48",Cámara Ip Fija Exterior 1080p Infrarrojo Visión Panorámica
,"U$S24,99",Cortadora Maquina Rasuradora Lana Mascotas Perro Recargable
,U$S99,Pro Plan Active Mind 15kg Envió Gratis + Vaso Medidor
,"U$S4,30",Cono Anti-mordeduras Transparrente Para Perros
,"U$S59,50",Cani Mentos Cachorro 25kg
,U$S37,Puertas Para Mascotas Perros O Gatos Marca Petwoodesign
,U$S500,Cachorros Samoyedo 100% Puros Envíos A Nivel Nacional
,"U$S12,98",Maquina De Cortar Cabello Para Mascotas Electrica
,"U$S6,89",Forro Protector De Asiento De Auto Para Mascotas
,U$S38,Italcan Pollo Alimento Para Perro
,"U$S3,40",Repelente Ultrasonico De Roedores Ratas Ratones 50mt2
,U$S190,Cachorritos Snhauzer
,"U$S4,50",Identificación Mascotas Placas Incluye Grabado
,U$S410,Cachorros  Beagle Envios A Nivel Nacional
,U$S90,Pro Plan Puppy Complete 15kg Envio Gratis + Helado/ Galletas
,U$S83,Casas Para Perros Grande Marca Rimax A Domicilio
